{
  "$schema": "https://json-schema.org/draft/2020-12/schema",
  "$id": "https://raw.githubusercontent.com/NextProb/nextprob-plugin-registry/main/schemas/metadata.schema.json",
  "title": "NextProb plugin marketplace metadata",
  "description": "Authored marketplace metadata stored as metadata.json at the root of a plugin directory. The publisher must exist in owners.json and must match the registry-derived owner of the plugin id.",
  "type": "object",
  "required": ["publisher", "license", "categories", "summary", "releaseNotes"],
  "properties": {
    "publisher": {
      "type": "string",
      "pattern": "^(?!(?:[Cc][Oo][Nn]|[Pp][Rr][Nn]|[Aa][Uu][Xx]|[Nn][Uu][Ll]|[Cc][Oo][Mm][1-9]|[Ll][Pp][Tt][1-9])(?:\\.|$))(?!.*\\.$)[a-zA-Z0-9][a-zA-Z0-9._-]{0,79}$",
      "description": "Publisher id defined in owners.json. Must equal the owner derived from the plugin id."
    },
    "license": {
      "type": "string",
      "minLength": 1,
      "description": "SPDX license expression for the plugin, for example AGPL-3.0-or-later or MIT."
    },
    "categories": {
      "type": "array",
      "minItems": 1,
      "maxItems": 3,
      "uniqueItems": true,
      "items": {
        "enum": ["export", "publishing", "automation", "integration", "productivity", "developer", "theme"]
      },
      "description": "One to three marketplace categories from the allowlist."
    },
    "summary": {
      "type": "string",
      "minLength": 1,
      "maxLength": 280,
      "description": "Short marketplace summary, 1-280 characters."
    },
    "releaseNotes": {
      "type": "string",
      "minLength": 1,
      "description": "Non-empty release notes for the current plugin version."
    },
    "displayName": {
      "type": "string",
      "minLength": 1,
      "maxLength": 200,
      "description": "Optional marketplace display name when it differs from the runtime manifest name."
    },
    "icon": {
      "type": "string",
      "minLength": 1,
      "pattern": "^(?!/)(?![A-Za-z]:)(?!.*\\\\)(?!.*(?:^|/)\\.\\.(?:/|$))[^\\u0000]+$",
      "description": "Package-relative regular file containing the marketplace icon. The file must exist."
    },
    "documentation": {
      "type": "string",
      "minLength": 1,
      "pattern": "^(?!/)(?![A-Za-z]:)(?!.*\\\\)(?!.*(?:^|/)\\.\\.(?:/|$))[^\\u0000]+$",
      "description": "Package-relative documentation file. Defaults to README.md when omitted."
    },
    "source": {
      "type": "string",
      "format": "uri",
      "pattern": "^https://",
      "description": "HTTPS URL of the plugin source repository."
    },
    "homepage": {
      "type": "string",
      "format": "uri",
      "pattern": "^https://",
      "description": "Optional project homepage URL."
    },
    "deprecated": {
      "type": "boolean",
      "description": "Marks the plugin as deprecated in the marketplace. Deprecated versions remain installable for compatibility."
    },
    "withdrawn": {
      "type": "boolean",
      "description": "Marks the plugin as withdrawn. Withdrawal is expressed in metadata; published packages and releases are never deleted or rewritten."
    },
    "replacement": {
      "type": "string",
      "pattern": "^(?!(?:[Cc][Oo][Nn]|[Pp][Rr][Nn]|[Aa][Uu][Xx]|[Nn][Uu][Ll]|[Cc][Oo][Mm][1-9]|[Ll][Pp][Tt][1-9])(?:\\.|$))(?!.*\\.$)[a-zA-Z0-9][a-zA-Z0-9._-]{0,79}$",
      "description": "Optional plugin id suggested to users when this plugin is deprecated or withdrawn."
    }
  },
  "additionalProperties": false
}
