{
  "publisher": "nextprob",
  "license": "MIT",
  "categories": [
    "export"
  ],
  "summary": "Provides shared export tools and the export menu used by other extensions.",
  "displayName": "Export Engine",
  "documentation": "README.md",
  "source": "https://github.com/NextProb/nextprob-plugin-registry/tree/main/plugins/nextprob.export-engine",
  "releaseNotes": "Relicense this official plugin under the MIT License."
}
