{
  "publisher": "nextprob",
  "license": "MIT",
  "categories": [
    "publishing"
  ],
  "summary": "Publishes notes as self-contained GitHub-backed links, with no export plugin or first-use download required.",
  "displayName": "Publishing",
  "documentation": "README.md",
  "source": "https://github.com/NextProb/nextprob-plugin-registry/tree/main/plugins/nextprob.publishing",
  "releaseNotes": "Relicense this official plugin under the MIT License."
}
