{
  "publisher": "nextprob",
  "license": "AGPL-3.0-only",
  "categories": [
    "export"
  ],
  "summary": "Saves notes as PDF documents rendered by the app's own Chromium print pipeline.",
  "displayName": "Export PDF",
  "documentation": "README.md",
  "source": "https://github.com/NextProb/nextprob-plugin-registry/tree/main/plugins/nextprob.export-pdf",
  "releaseNotes": "Initial registry release."
}
