{
  "publisher": "nextprob",
  "license": "AGPL-3.0-only",
  "categories": [
    "export"
  ],
  "summary": "Saves the text of your notes as plain text files, preserving headings, lists, tables, and code block whitespace.",
  "displayName": "Export Plain Text",
  "documentation": "README.md",
  "source": "https://github.com/NextProb/nextprob-plugin-registry/tree/main/plugins/nextprob.export-plaintext",
  "releaseNotes": "Initial registry release."
}
